id,title,authors,year,venue,citation_count,source_url,pdf_url,abstract,referenced_works
P048,Zero-Shot Detection of AI-Generated Images,"['Davide Cozzolino', 'Giovanni Poggi', 'Matthias Nießner', 'Luisa Verdoliva']",2024.0,arXiv (Cornell University),2,http://arxiv.org/abs/2409.15875,https://arxiv.org/pdf/2409.15875,"Detecting AI-generated images has become an extraordinarily difficult challenge as new generative architectures emerge on a daily basis with more and more capabilities and unprecedented realism. New versions of many commercial tools, such as DALLE, Midjourney, and Stable Diffusion, have been released recently, and it is impractical to continually update and retrain supervised forensic detectors to handle such a large variety of models. To address this challenge, we propose a zero-shot entropy-based detector (ZED) that neither needs AI-generated training data nor relies on knowledge of generative architectures to artificially synthesize their artifacts. Inspired by recent works on machine-generated text detection, our idea is to measure how surprising the image under analysis is compared to a model of real images. To this end, we rely on a lossless image encoder that estimates the probability distribution of each pixel given its context. To ensure computational efficiency, the encoder has a multi-resolution architecture and contexts comprise mostly pixels of the lower-resolution version of the image.Since only real images are needed to learn the model, the detector is independent of generator architectures and synthetic training data. Using a single discriminative feature, the proposed detector achieves state-of-the-art performance. On a wide variety of generative models it achieves an average improvement of more than 3% over the SoTA in terms of accuracy. Code is available at https://grip-unina.github.io/ZED/.",[]
P049,RIGID: A Training-free and Model-Agnostic Framework for Robust AI-Generated Image Detection,"['Zhiyuan He', 'Pin‐Yu Chen', 'Tsung-Yi Ho']",2024.0,arXiv (Cornell University),2,http://arxiv.org/abs/2405.20112,https://arxiv.org/pdf/2405.20112,"The rapid advances in generative AI models have empowered the creation of highly realistic images with arbitrary content, raising concerns about potential misuse and harm, such as Deepfakes. Current research focuses on training detectors using large datasets of generated images. However, these training-based solutions are often computationally expensive and show limited generalization to unseen generated images. In this paper, we propose a training-free method to distinguish between real and AI-generated images. We first observe that real images are more robust to tiny noise perturbations than AI-generated images in the representation space of vision foundation models. Based on this observation, we propose RIGID, a training-free and model-agnostic method for robust AI-generated image detection. RIGID is a simple yet effective approach that identifies whether an image is AI-generated by comparing the representation similarity between the original and the noise-perturbed counterpart. Our evaluation on a diverse set of AI-generated images and benchmarks shows that RIGID significantly outperforms existing trainingbased and training-free detectors. In particular, the average performance of RIGID exceeds the current best training-free method by more than 25%. Importantly, RIGID exhibits strong generalization across different image generation methods and robustness to image corruptions.",[]
P050,FakeBench: Probing Explainable Fake Image Detection via Large Multimodal Models,"['Yixuan Li', 'Xuelin Liu', 'Xiaoyang Wang', 'Lee, Bu Sung', 'Shiqi Wang', 'Rocha, Anderson', 'Weisi Lin']",2024.0,arXiv (Cornell University),2,http://arxiv.org/abs/2404.13306,https://arxiv.org/pdf/2404.13306,"The ability to distinguish whether an image is generated by artificial intelligence (AI) is a crucial ingredient in human intelligence, usually accompanied by a complex and dialectical forensic and reasoning process. However, current fake image detection models and databases focus on binary classification without understandable explanations for the general populace. This weakens the credibility of authenticity judgment and may conceal potential model biases. Meanwhile, large multimodal models (LMMs) have exhibited immense visual-text capabilities on various tasks, bringing the potential for explainable fake image detection. Therefore, we pioneer the probe of LMMs for explainable fake image detection by presenting a multimodal database encompassing textual authenticity descriptions, the FakeBench. For construction, we first introduce a fine-grained taxonomy of generative visual forgery concerning human perception, based on which we collect forgery descriptions in human natural language with a human-in-the-loop strategy. FakeBench examines LMMs with four evaluation criteria: detection, reasoning, interpretation and fine-grained forgery analysis, to obtain deeper insights into image authenticity-relevant capabilities. Experiments on various LMMs confirm their merits and demerits in different aspects of fake image detection tasks. This research presents a paradigm shift towards transparency for the fake image detection area and reveals the need for greater emphasis on forensic elements in visual-language research and AI risk control. FakeBench will be available at https://github.com/Yixuan423/FakeBench.",[]
P051,A Sanity Check for AI-generated Image Detection,"['Shilin Yan', 'Ouxiang Li', 'Jiayin Cai', 'Yanbin Hao', 'Xiaolong Jiang', 'Yao Hu', 'Weidi Xie']",2024.0,arXiv (Cornell University),2,http://arxiv.org/abs/2406.19435,https://arxiv.org/pdf/2406.19435,"With the rapid development of generative models, discerning AI-generated content has evoked increasing attention from both industry and academia. In this paper, we conduct a sanity check on ""whether the task of AI-generated image detection has been solved"". To start with, we present Chameleon dataset, consisting AIgenerated images that are genuinely challenging for human perception. To quantify the generalization of existing methods, we evaluate 9 off-the-shelf AI-generated image detectors on Chameleon dataset. Upon analysis, almost all models classify AI-generated images as real ones. Later, we propose AIDE (AI-generated Image DEtector with Hybrid Features), which leverages multiple experts to simultaneously extract visual artifacts and noise patterns. Specifically, to capture the high-level semantics, we utilize CLIP to compute the visual embedding. This effectively enables the model to discern AI-generated images based on semantics or contextual information; Secondly, we select the highest frequency patches and the lowest frequency patches in the image, and compute the low-level patchwise features, aiming to detect AI-generated images by low-level artifacts, for example, noise pattern, anti-aliasing, etc. While evaluating on existing benchmarks, for example, AIGCDetectBenchmark and GenImage, AIDE achieves +3.5% and +4.6% improvements to state-of-the-art methods, and on our proposed challenging Chameleon benchmarks, it also achieves the promising results, despite this problem for detecting AI-generated images is far from being solved.",[]
P052,Robust CLIP-Based Detector for Exposing Diffusion Model-Generated Images,"['Santosh', 'Lin Li', 'Irene Amerini', 'Xin Wang', 'Shu Hu']",2024.0,arXiv (Cornell University),2,http://arxiv.org/abs/2404.12908,https://arxiv.org/pdf/2404.12908,"Diffusion models (DMs) have revolutionized image generation, producing high-quality images with applications spanning various fields. However, their ability to create hyper-realistic images poses significant challenges in distinguishing between real and synthetic content, raising concerns about digital authenticity and potential misuse in creating deepfakes. This work introduces a robust detection framework that integrates image and text features extracted by CLIP model with a Multilayer Perceptron (MLP) classifier. We propose a novel loss that can improve the detector's robustness and handle imbalanced datasets. Additionally, we flatten the loss landscape during the model training to improve the detector's generalization capabilities. The effectiveness of our method, which outperforms traditional detection techniques, is demonstrated through extensive experiments, underscoring its potential to set a new state-of-the-art approach in DM-generated image detection. The code is available at https://github.com/Purdue-M2/Robust_DM_Generated_Image_Detection.",[]
P053,Frequency-Aware Deepfake Detection: Improving Generalizability through Frequency Space Learning,"['Chuangchuang Tan', 'Yao Zhao', 'Shikui Wei', 'Guanghua Gu', 'Ping Liu', 'Yunchao Wei']",2024.0,arXiv (Cornell University),2,http://arxiv.org/abs/2403.07240,https://arxiv.org/pdf/2403.07240,"This research addresses the challenge of developing a universal deepfake detector that can effectively identify unseen deepfake images despite limited training data. Existing frequency-based paradigms have relied on frequency-level artifacts introduced during the up-sampling in GAN pipelines to detect forgeries. However, the rapid advancements in synthesis technology have led to specific artifacts for each generation model. Consequently, these detectors have exhibited a lack of proficiency in learning the frequency domain and tend to overfit to the artifacts present in the training data, leading to suboptimal performance on unseen sources. To address this issue, we introduce a novel frequency-aware approach called FreqNet, centered around frequency domain learning, specifically designed to enhance the generalizability of deepfake detectors. Our method forces the detector to continuously focus on high-frequency information, exploiting high-frequency representation of features across spatial and channel dimensions. Additionally, we incorporate a straightforward frequency domain learning module to learn source-agnostic features. It involves convolutional layers applied to both the phase spectrum and amplitude spectrum between the Fast Fourier Transform (FFT) and Inverse Fast Fourier Transform (iFFT). Extensive experimentation involving 17 GANs demonstrates the effectiveness of our proposed method, showcasing state-of-the-art performance (+9.8\%) while requiring fewer parameters. The code is available at {\cred \url{https://github.com/chuangchuangtan/FreqNet-DeepfakeDetection}}.",[]
P054,ODDN: Addressing Unpaired Data Challenges in Open-World Deepfake Detection on Online Social Networks,"['Renshuai Tao', 'M. Le', 'C. Kenneth Tan', 'Huan Liu', 'Haotong Qin', 'Yao Zhao']",2025.0,Proceedings of the AAAI Conference on Artificial Intelligence,2,https://doi.org/10.1609/aaai.v39i1.32063,https://ojs.aaai.org/index.php/AAAI/article/download/32063/34218,"Despite significant advances in deepfake detection, handling varying image quality, especially due to different compressions on online social networks (OSNs), remains challenging. Current methods succeed by leveraging correlations between paired images, whether raw or compressed. However, in open-world scenarios, paired data is scarce, with compressed images readily available but corresponding raw versions difficult to obtain. This imbalance, where unpaired data vastly outnumbers paired data, often leads to reduced detection performance, as existing methods struggle without corresponding raw images. To overcome this issue, we propose a novel approach named the open-world deepfake detection network (ODDN), which comprises two core modules: open-world data aggregation (ODA) and compression-discard gradient correction (CGC). ODA effectively aggregates correlations between compressed and raw samples through both fine-grained and coarse-grained analyses for paired and unpaired data, respectively. CGC incorporates a compression-discard gradient correction to further enhance performance across diverse compression methods in OSN. This technique optimizes the training gradient to ensure the model remains insensitive to compression variations. Extensive experiments conducted on 17 popular deepfake datasets demonstrate the superiority of the ODDN over SOTA baselines.",[]
P055,DeepFake-O-Meter v2.0: An Open Platform for DeepFake Detection,"['Yan Ju', 'Chengzhe Sun', 'Shan Jia', 'Shuwei Hou', 'Si, Zhaofeng', 'Datta, Soumyya Kanti', 'Lipeng Ke', 'Riky Zhou', 'Anita Nikolich', 'Siwei Lyu']",2024.0,arXiv (Cornell University),2,http://arxiv.org/abs/2404.13146,https://arxiv.org/pdf/2404.13146,"Deepfakes, as AI-generated media, have increasingly threatened media integrity and personal privacy with realistic yet fake digital content. In this work, we introduce an open-source and user-friendly online platform, DeepFake-O-Meter v2.0, that integrates state-of-the-art methods for detecting Deepfake images, videos, and audio. Built upon DeepFake-O-Meter v1.0, we have made significant upgrades and improvements in platform architecture design, including user interaction, detector integration, job balancing, and security management. The platform aims to offer everyday users a convenient service for analyzing DeepFake media using multiple state-of-the-art detection algorithms. It ensures secure and private delivery of the analysis results. Furthermore, it serves as an evaluation and benchmarking platform for researchers in digital media forensics to compare the performance of multiple algorithms on the same input. We have also conducted detailed usage analysis based on the collected data to gain deeper insights into our platform's statistics. This involves analyzing two-month trends in user activity and evaluating the processing efficiency of each detector.",[]
P056,Rethinking the Up-Sampling Operations in CNN-based Generative Network for Generalizable Deepfake Detection,"['Chuangchuang Tan', 'Liu, Huan', 'Yao Zhao', 'Shikui Wei', 'Guanghua Gu', 'Ping Liu', 'Yunchao Wei']",2023.0,arXiv (Cornell University),2,http://arxiv.org/abs/2312.10461,https://arxiv.org/pdf/2312.10461,"Recently, the proliferation of highly realistic synthetic images, facilitated through a variety of GANs and Diffusions, has significantly heightened the susceptibility to misuse. While the primary focus of deepfake detection has traditionally centered on the design of detection algorithms, an investigative inquiry into the generator architectures has remained conspicuously absent in recent years. This paper contributes to this lacuna by rethinking the architectures of CNN-based generators, thereby establishing a generalized representation of synthetic artifacts. Our findings illuminate that the up-sampling operator can, beyond frequency-based artifacts, produce generalized forgery artifacts. In particular, the local interdependence among image pixels caused by upsampling operators is significantly demonstrated in synthetic images generated by GAN or diffusion. Building upon this observation, we introduce the concept of Neighboring Pixel Relationships(NPR) as a means to capture and characterize the generalized structural artifacts stemming from up-sampling operations. A comprehensive analysis is conducted on an open-world dataset, comprising samples generated by \tft{28 distinct generative models}. This analysis culminates in the establishment of a novel state-of-the-art performance, showcasing a remarkable \tft{11.6\%} improvement over existing methods. The code is available at https://github.com/chuangchuangtan/NPR-DeepfakeDetection.",[]
P057,Weakly-supervised deepfake localization in diffusion-generated images,"['Dragos Tantaru', 'Elisabeta Oneaţă', 'Dan Oneaţă']",2023.0,arXiv (Cornell University),2,http://arxiv.org/abs/2311.04584,https://arxiv.org/pdf/2311.04584,"The remarkable generative capabilities of denoising diffusion models have raised new concerns regarding the authenticity of the images we see every day on the Internet. However, the vast majority of existing deepfake detection models are tested against previous generative approaches (e.g. GAN) and usually provide only a ""fake"" or ""real"" label per image. We believe a more informative output would be to augment the per-image label with a localization map indicating which regions of the input have been manipulated. To this end, we frame this task as a weakly-supervised localization problem and identify three main categories of methods (based on either explanations, local scores or attention), which we compare on an equal footing by using the Xception network as the common backbone architecture. We provide a careful analysis of all the main factors that parameterize the design space: choice of method, type of supervision, dataset and generator used in the creation of manipulated images; our study is enabled by constructing datasets in which only one of the components is varied. Our results show that weakly-supervised localization is attainable, with the best performing detection method (based on local scores) being less sensitive to the looser supervision than to the mismatch in terms of dataset or generator.",[]
P058,Examining the role of compression in influencing AI-generated image authenticity,"['Xiaohan Fang', 'Peilin Chen', 'Meng Wang', 'Shiqi Wang']",2025.0,Scientific Reports,2,https://doi.org/10.1038/s41598-025-91545-4,https://www.nature.com/articles/s41598-025-91545-4.pdf,"The rapid development of AI-generated Content (AIGC) in recent years has narrowed the gap between virtual and realistic. Among them, AI-generated Images (AIGIs) are particularly significant, as their emergence has led to a profound impact on education, art, virtual reality, etc. However, little research has been conducted to investigate whether compression artifacts can influence the subjective authenticity of AIGIs. In this paper, we systematically study this problem by creating the first-ever AIGC image dataset for subjective evaluations of authenticity discrimination. The dataset contains 500 AIGIs and 500 natural images with a resolution of 768 × 768. The content of the images therein has been categorized into 5 major categories and 20 subcategories to study the performance of AIGIs on different contents. Subsequently, we introduce four varying degrees of compression distortion (QP = 22, 32, 42, 52) on all images utilizing the standard Versatile Video Coding (VVC). It is interesting to find that with an increase in compression distortion, the accuracy of human vision in determining the AIGIs descends. The proposed study is expected to shed light on future research that aims to achieve a good balance between authenticity and visual quality.","['https://openalex.org/W1861492603', 'https://openalex.org/W1901129140', 'https://openalex.org/W1977725648', 'https://openalex.org/W1982471090', 'https://openalex.org/W2051596736', 'https://openalex.org/W2066380143', 'https://openalex.org/W2084235337', 'https://openalex.org/W2102166818', 'https://openalex.org/W2133665775', 'https://openalex.org/W2146395539', 'https://openalex.org/W2565312867', 'https://openalex.org/W2618902759', 'https://openalex.org/W2798581339', 'https://openalex.org/W2905544033', 'https://openalex.org/W2962750014', 'https://openalex.org/W2962785568', 'https://openalex.org/W2962845008', 'https://openalex.org/W2963073614', 'https://openalex.org/W2964060609', 'https://openalex.org/W2969924190', 'https://openalex.org/W2975641859', 'https://openalex.org/W2996331473', 'https://openalex.org/W3003301247', 'https://openalex.org/W3017136408', 'https://openalex.org/W3030380536', 'https://openalex.org/W3034469748', 'https://openalex.org/W3035719652', 'https://openalex.org/W3096831136', 'https://openalex.org/W3098560717', 'https://openalex.org/W3135367836', 'https://openalex.org/W3135479537', 'https://openalex.org/W3135530072', 'https://openalex.org/W3152708635', 'https://openalex.org/W3153323090', 'https://openalex.org/W3176913662', 'https://openalex.org/W3194280054', 'https://openalex.org/W3202767484', 'https://openalex.org/W3212516020', 'https://openalex.org/W4214745154', 'https://openalex.org/W4226263392', 'https://openalex.org/W4226348722', 'https://openalex.org/W4281485151', 'https://openalex.org/W4283705032', 'https://openalex.org/W4285178079', 'https://openalex.org/W4290647491', 'https://openalex.org/W4308234128', 'https://openalex.org/W4308579274', 'https://openalex.org/W4308623137', 'https://openalex.org/W4312438583', 'https://openalex.org/W4312933868', 'https://openalex.org/W4313384121', 'https://openalex.org/W4366201452', 'https://openalex.org/W4366396176', 'https://openalex.org/W4366548225', 'https://openalex.org/W4383058345', 'https://openalex.org/W4384703230', 'https://openalex.org/W4386065854', 'https://openalex.org/W4386066603', 'https://openalex.org/W4386071814', 'https://openalex.org/W4386072096', 'https://openalex.org/W4386076643', 'https://openalex.org/W4386076657', 'https://openalex.org/W4386113271', 'https://openalex.org/W4386211581', 'https://openalex.org/W4386214843', 'https://openalex.org/W4387010079', 'https://openalex.org/W4390873054', 'https://openalex.org/W4390874260', 'https://openalex.org/W4391490252', 'https://openalex.org/W4405181141', 'https://openalex.org/W6600018615', 'https://openalex.org/W6600631002', 'https://openalex.org/W6600741150', 'https://openalex.org/W6600960895']"
P059,Detecting the Undetectable: Combining Kolmogorov-Arnold Networks and MLP for AI-Generated Image Detection,"['Taharim Rahman Anon', 'Jakaria Islam Emon']",2024.0,arXiv (Cornell University),1,http://arxiv.org/abs/2408.09371,https://arxiv.org/pdf/2408.09371,"As artificial intelligence progresses, the task of distinguishing between real and AI-generated images is increasingly complicated by sophisticated generative models. This paper presents a novel detection framework adept at robustly identifying images produced by cutting-edge generative AI models, such as DALL-E 3, MidJourney, and Stable Diffusion 3. We introduce a comprehensive dataset, tailored to include images from these advanced generators, which serves as the foundation for extensive evaluation. we propose a classification system that integrates semantic image embeddings with a traditional Multilayer Perceptron (MLP). This baseline system is designed to effectively differentiate between real and AI-generated images under various challenging conditions. Enhancing this approach, we introduce a hybrid architecture that combines Kolmogorov-Arnold Networks (KAN) with the MLP. This hybrid model leverages the adaptive, high-resolution feature transformation capabilities of KAN, enabling our system to capture and analyze complex patterns in AI-generated images that are typically overlooked by conventional models. In out-of-distribution testing, our proposed model consistently outperformed the standard MLP across three out of distribution test datasets, demonstrating superior performance and robustness in classifying real images from AI-generated images with impressive F1 scores.",[]
