id,title,authors,year,venue,citation_count,source_url,pdf_url,abstract,referenced_works
P084,Deepfakes Classification of Faces Using Convolutional Neural Networks,"['Jatin Sharma', 'Sahil Sharma', 'Vijay Kumar', 'Hany S. Hussein', 'Hammam Alshazly']",2022.0,Traitement du signal,41,https://doi.org/10.18280/ts.390330,https://www.iieta.org/download/file/fid/78449,"In the recent years, petabytes of data is being generated and uploaded online every second. To successfully detect fake contents, a deepfake detection technique is used to determine whether the uploaded content is real or fake. In this paper, a convolutional neural network-based model is proposed to detect the fake face images. The generative adversarial networks and data augmentation are used to generate the face dataset for real and fake face classification. Transfer learning techniques from pretrained deep models such as VGG16 and ResNet50 are employed in the proposed model. The proposed model is evaluated on three benchmark datasets, namely 140k Real and Fake Faces, Real and Fake Face Detection, and Fake Faces. The proposed model attained accuracies over the three datasets are 95.85%, 53.25%, and 88.63%, respectively. Moreover, to improve the obtained results of the proposed model, we combine it with other pretrained models of VGG16 and ResNet50 to construct deep ensembles. The overall performance is greatly improved with the ensemble model achieving accuracies on the three datasets as 98.79%, 75.79%, and 95.52%, respectively. Furthermore, the obtained results also show that the proposed models have superior performance than existing models.","['https://openalex.org/W199051323', 'https://openalex.org/W1686810756', 'https://openalex.org/W1834627138', 'https://openalex.org/W2097117768', 'https://openalex.org/W2117539524', 'https://openalex.org/W2142194269', 'https://openalex.org/W2183341477', 'https://openalex.org/W2194775991', 'https://openalex.org/W2515442425', 'https://openalex.org/W2558151185', 'https://openalex.org/W2774037436', 'https://openalex.org/W2794857359', 'https://openalex.org/W2902962850', 'https://openalex.org/W2904573504', 'https://openalex.org/W2911424785', 'https://openalex.org/W2943520232', 'https://openalex.org/W2946839282', 'https://openalex.org/W2962770929', 'https://openalex.org/W2962958939', 'https://openalex.org/W2963720850', 'https://openalex.org/W2970868842', 'https://openalex.org/W2982058372', 'https://openalex.org/W2985778816', 'https://openalex.org/W2990752111', 'https://openalex.org/W2998605827', 'https://openalex.org/W3009973819', 'https://openalex.org/W3014859719', 'https://openalex.org/W3034196597', 'https://openalex.org/W3034577585', 'https://openalex.org/W3034713808', 'https://openalex.org/W3034795015', 'https://openalex.org/W3036806226', 'https://openalex.org/W3038930935', 'https://openalex.org/W3043562661', 'https://openalex.org/W3045874508', 'https://openalex.org/W3107668149', 'https://openalex.org/W3113225218', 'https://openalex.org/W3124826036', 'https://openalex.org/W3158734383', 'https://openalex.org/W3172046373', 'https://openalex.org/W3183600011', 'https://openalex.org/W3189760401', 'https://openalex.org/W3203658938', 'https://openalex.org/W4200434941', 'https://openalex.org/W4236440698', 'https://openalex.org/W4287592659', 'https://openalex.org/W4287758545', 'https://openalex.org/W4288090950', 'https://openalex.org/W4294643831', 'https://openalex.org/W6761273942', 'https://openalex.org/W6910532203', 'https://openalex.org/W7064159440', 'https://openalex.org/W7064698583']"
P085,Deepfake Detection Using Spatiotemporal Transformer,"['Bachir Kaddar', 'Sid Ahmed Fezza', 'Zahid Akhtar', 'Wassim Hamidouche', 'Abdenour Hadid', 'Joan Serra-Sagristà']",2024.0,ACM Transactions on Multimedia Computing Communications and Applications,38,https://doi.org/10.1145/3643030,https://dl.acm.org/doi/pdf/10.1145/3643030,"Recent advances in generative models and the availability of large-scale benchmarks have made deepfake video generation and manipulation easier. Nowadays, the number of new hyper-realistic deepfake videos used for negative purposes is dramatically increasing, thus creating the need for effective deepfake detection methods. Although many existing deepfake detection approaches, particularly CNN-based methods, show promising results, they suffer from several drawbacks. In general, poor generalization results have been obtained under unseen/new deepfake generation methods. The crucial reason for the above defect is that CNN-based methods focus on the local spatial artifacts, which are unique for every manipulation method. Therefore, it is hard to learn the general forgery traces of different manipulation methods without considering the dependencies that extend beyond the local receptive field. To address this problem, this article proposes a framework that combines Convolutional Neural Network (CNN) with Vision Transformer (ViT) to improve detection accuracy and enhance generalizability. Our method, named HCiT , exploits the advantages of CNNs to extract meaningful local features, as well as the ViT’s self-attention mechanism to learn discriminative global contextual dependencies in a frame-level image explicitly. In this hybrid architecture, the high-level feature maps extracted from the CNN are fed into the ViT model that determines whether a specific video is fake or real. Experiments were performed on Faceforensics++, DeepFake Detection Challenge preview, Celeb datasets, and the results show that the proposed method significantly outperforms the state-of-the-art methods. In addition, the HCiT method shows a great capacity for generalization on datasets covering various techniques of deepfake generation. The source code is available at: https://github.com/KADDAR-Bachir/HCiT","['https://openalex.org/W172260869', 'https://openalex.org/W2009130368', 'https://openalex.org/W2023556846', 'https://openalex.org/W2025768430', 'https://openalex.org/W2093512257', 'https://openalex.org/W2095613088', 'https://openalex.org/W2108598243', 'https://openalex.org/W2109255472', 'https://openalex.org/W2115252128', 'https://openalex.org/W2194775991', 'https://openalex.org/W2341528187', 'https://openalex.org/W2412509443', 'https://openalex.org/W2531409750', 'https://openalex.org/W2541922885', 'https://openalex.org/W2774037436', 'https://openalex.org/W2786289897', 'https://openalex.org/W2787595978', 'https://openalex.org/W2798117183', 'https://openalex.org/W2802701183', 'https://openalex.org/W2806609126', 'https://openalex.org/W2808763756', 'https://openalex.org/W2811325011', 'https://openalex.org/W2811414481', 'https://openalex.org/W2883289607', 'https://openalex.org/W2888338418', 'https://openalex.org/W2890052933', 'https://openalex.org/W2891145043', 'https://openalex.org/W2903369540', 'https://openalex.org/W2911424785', 'https://openalex.org/W2912940386', 'https://openalex.org/W2913399670', 'https://openalex.org/W2914447220', 'https://openalex.org/W2945262873', 'https://openalex.org/W2962958939', 'https://openalex.org/W2963172626', 'https://openalex.org/W2963616706', 'https://openalex.org/W2963684180', 'https://openalex.org/W2963720850', 'https://openalex.org/W2964350391', 'https://openalex.org/W2979259381', 'https://openalex.org/W2982058372', 'https://openalex.org/W2991318208', 'https://openalex.org/W2995516027', 'https://openalex.org/W3011820288', 'https://openalex.org/W3019200173', 'https://openalex.org/W3034196597', 'https://openalex.org/W3034552680', 'https://openalex.org/W3034713808', 'https://openalex.org/W3038930935', 'https://openalex.org/W3040168631', 'https://openalex.org/W3083246145', 'https://openalex.org/W3096831136', 'https://openalex.org/W3101998545', 'https://openalex.org/W3125803510', 'https://openalex.org/W3135809943', 'https://openalex.org/W3136416617', 'https://openalex.org/W3137278571', 'https://openalex.org/W3154326567', 'https://openalex.org/W3162020795', 'https://openalex.org/W3174814557', 'https://openalex.org/W4200635057', 'https://openalex.org/W4236440698', 'https://openalex.org/W4313127140', 'https://openalex.org/W4313157251', 'https://openalex.org/W4383753813']"
P086,A Survey of Detection and Mitigation for Fake Images on Social Media Platforms,"['Dilip Kumar Sharma', 'Bhuvanesh Singh', 'Saurabh Agarwal', 'Lalit Garg', 'Cheonshik Kim', 'Ki‐Hyun Jung']",2023.0,Applied Sciences,36,https://doi.org/10.3390/app131910980,https://www.mdpi.com/2076-3417/13/19/10980/pdf?version=1696505121,"Recently, the spread of fake images on social media platforms has become a significant concern for individuals, organizations, and governments. These images are often created using sophisticated techniques to spread misinformation, influence public opinion, and threaten national security. This paper begins by defining fake images and their potential impact on society, including the spread of misinformation and the erosion of trust in digital media. This paper also examines the different types of fake images and their challenges for detection. We then review the recent approaches proposed for detecting fake images, including digital forensics, machine learning, and deep learning. These approaches are evaluated in terms of their strengths and limitations, highlighting the need for further research. This paper also highlights the need for multimodal approaches that combine multiple sources of information, such as text, images, and videos. Furthermore, we present an overview of existing datasets, evaluation metrics, and benchmarking tools for fake image detection. This paper concludes by discussing future directions for fake image detection research, such as developing more robust and explainable methods, cross-modal fake detection, and the integration of social context. It also emphasizes the need for interdisciplinary research that combines computer science, digital forensics, and cognitive psychology experts to tackle the complex problem of fake images. This survey paper will be a valuable resource for researchers and practitioners working on fake image detection on social media platforms.","['https://openalex.org/W1796766288', 'https://openalex.org/W1967749904', 'https://openalex.org/W1985729543', 'https://openalex.org/W1991430118', 'https://openalex.org/W2037801532', 'https://openalex.org/W2039945310', 'https://openalex.org/W2061980302', 'https://openalex.org/W2071794886', 'https://openalex.org/W2080403050', 'https://openalex.org/W2089818991', 'https://openalex.org/W2116733004', 'https://openalex.org/W2118779391', 'https://openalex.org/W2119952502', 'https://openalex.org/W2142738546', 'https://openalex.org/W2162192649', 'https://openalex.org/W2168207099', 'https://openalex.org/W2257787933', 'https://openalex.org/W2409050142', 'https://openalex.org/W2412509443', 'https://openalex.org/W2417511053', 'https://openalex.org/W2531862055', 'https://openalex.org/W2563692119', 'https://openalex.org/W2572561073', 'https://openalex.org/W2595185515', 'https://openalex.org/W2742330194', 'https://openalex.org/W2752015292', 'https://openalex.org/W2761220752', 'https://openalex.org/W2768603575', 'https://openalex.org/W2777769595', 'https://openalex.org/W2793680140', 'https://openalex.org/W2800327877', 'https://openalex.org/W2801257769', 'https://openalex.org/W2802701183', 'https://openalex.org/W2809476703', 'https://openalex.org/W2810806782', 'https://openalex.org/W2892850415', 'https://openalex.org/W2912305564', 'https://openalex.org/W2912938607', 'https://openalex.org/W2913399670', 'https://openalex.org/W2914447220', 'https://openalex.org/W2920854848', 'https://openalex.org/W2948407537', 'https://openalex.org/W2962717349', 'https://openalex.org/W2964146055', 'https://openalex.org/W2965545961', 'https://openalex.org/W2970868842', 'https://openalex.org/W2975393663', 'https://openalex.org/W2975558816', 'https://openalex.org/W2979259381', 'https://openalex.org/W2994071599', 'https://openalex.org/W2998236504', 'https://openalex.org/W2999790948', 'https://openalex.org/W3000668845', 'https://openalex.org/W3008227768', 'https://openalex.org/W3014806201', 'https://openalex.org/W3021904838', 'https://openalex.org/W3022924198', 'https://openalex.org/W3023208170', 'https://openalex.org/W3030648110', 'https://openalex.org/W3034577585', 'https://openalex.org/W3038930935', 'https://openalex.org/W3040168631', 'https://openalex.org/W3046544926', 'https://openalex.org/W3048227452', 'https://openalex.org/W3082623289', 'https://openalex.org/W3086215331', 'https://openalex.org/W3086623482', 'https://openalex.org/W3087718639', 'https://openalex.org/W3090505016', 'https://openalex.org/W3095216187', 'https://openalex.org/W3106990721', 'https://openalex.org/W3118971208', 'https://openalex.org/W3119523238', 'https://openalex.org/W3119775597', 'https://openalex.org/W3119882139', 'https://openalex.org/W3129315061', 'https://openalex.org/W3129616433', 'https://openalex.org/W3134500368', 'https://openalex.org/W3135925326', 'https://openalex.org/W3136017287', 'https://openalex.org/W3136329963', 'https://openalex.org/W3138649308', 'https://openalex.org/W3140970613', 'https://openalex.org/W3150953232', 'https://openalex.org/W3158119314', 'https://openalex.org/W3164782458', 'https://openalex.org/W3168331896', 'https://openalex.org/W3173631964', 'https://openalex.org/W3179308556', 'https://openalex.org/W3191117306', 'https://openalex.org/W3192602971', 'https://openalex.org/W3192915988', 'https://openalex.org/W3197106219', 'https://openalex.org/W3206010663', 'https://openalex.org/W3207204470', 'https://openalex.org/W4205620807', 'https://openalex.org/W4205752812', 'https://openalex.org/W4206589716', 'https://openalex.org/W4206706211', 'https://openalex.org/W4212815050', 'https://openalex.org/W4214577322', 'https://openalex.org/W4225981475', 'https://openalex.org/W4249545460', 'https://openalex.org/W4255023712', 'https://openalex.org/W4281659969', 'https://openalex.org/W4283074508', 'https://openalex.org/W4283379667', 'https://openalex.org/W4285117155', 'https://openalex.org/W4285303682', 'https://openalex.org/W4285390910', 'https://openalex.org/W4287958448', 'https://openalex.org/W4290617287', 'https://openalex.org/W4292794770', 'https://openalex.org/W4295864911', 'https://openalex.org/W4386246256', 'https://openalex.org/W6604906609', 'https://openalex.org/W6639683851', 'https://openalex.org/W6670314232', 'https://openalex.org/W6679542102', 'https://openalex.org/W6734635128', 'https://openalex.org/W6756397456', 'https://openalex.org/W6760599490', 'https://openalex.org/W6771946741', 'https://openalex.org/W6781212736']"
P087,Deepfakes: temporal sequential analysis to detect face-swapped video clips using convolutional long short-term memory,"['Sawinder Kaur', 'Parteek Kumar', 'Ponnurangam Kumaraguru']",2020.0,Journal of Electronic Imaging,35,https://doi.org/10.1117/1.jei.29.3.033013,https://www.spiedigitallibrary.org/journals/journal-of-electronic-imaging/volume-29/issue-3/033013/Deepfakes--temporal-sequential-analysis-to-detect-face-swapped-video/10.1117/1.JEI.29.3.033013.pdf,"Deepfake (a bag of “deep learning” and “fake”) is a technique for human image synthesis based on artificial intelligence, i.e., to superimpose the existing (source) images or videos onto destination images or videos using neural networks (NNs). Deepfake enthusiasts have been using NNs to produce convincing face swaps. Deepfakes are a type of video or image forgery developed to spread misinformation, invade privacy, and mask the truth using advanced technologies such as trained algorithms, deep learning applications, and artificial intelligence. They have become a nuisance to social media users by publishing fake videos created by fusing a celebrity’s face over an explicit video. The impact of deepfakes is alarming, with politicians, senior corporate officers, and world leaders being targeted by nefarious actors. An approach to detect deepfake videos of politicians using temporal sequential frames is proposed. The proposed approach uses the forged video to extract the frames at the first level followed by a deep depth-based convolutional long short-term memory model to identify the fake frames at the second level. Also the proposed model is evaluated on our newly collected ground truth dataset of forged videos using source and destination video frames of famous politicians. Experimental results demonstrate the effectiveness of our method.",[]
P088,Generative Artificial Intelligence and the Evolving Challenge of Deepfake Detection: A Systematic Analysis,"['Reza Babaei', 'Samuel Cheng', 'Rui Duan', 'Shangqing Zhao']",2025.0,Journal of Sensor and Actuator Networks,34,https://doi.org/10.3390/jsan14010017,https://www.mdpi.com/2224-2708/14/1/17/pdf,"Deepfake technology, which employs advanced generative artificial intelligence to create hyper-realistic synthetic media, poses significant challenges across various sectors, including security, entertainment, and education. This literature review explores the evolution of deepfake generation methods, ranging from traditional techniques to state-of-the-art models such as generative adversarial networks and diffusion models. We navigate through the effectiveness and limitations of various detection approaches, including machine learning, forensic analysis, and hybrid techniques, while highlighting the critical importance of interpretability and real-time performance in detection systems. Furthermore, we discuss the ethical implications and regulatory considerations surrounding deepfake technology, emphasizing the need for comprehensive frameworks to mitigate risks associated with misinformation and manipulation. Through a systematic review of the existing literature, our aim is to identify research gaps and future directions for the development of robust, adaptable detection systems that can keep pace with rapid advancements in deepfake generation.","['https://openalex.org/W2083192529', 'https://openalex.org/W2142194269', 'https://openalex.org/W2301937176', 'https://openalex.org/W2558151185', 'https://openalex.org/W2608058963', 'https://openalex.org/W2738406145', 'https://openalex.org/W2884460600', 'https://openalex.org/W2891145043', 'https://openalex.org/W2898712164', 'https://openalex.org/W2902166766', 'https://openalex.org/W2902543210', 'https://openalex.org/W2909336075', 'https://openalex.org/W2911424785', 'https://openalex.org/W2912336782', 'https://openalex.org/W2913399670', 'https://openalex.org/W2914447220', 'https://openalex.org/W2920929600', 'https://openalex.org/W2921230249', 'https://openalex.org/W2942074357', 'https://openalex.org/W2962793481', 'https://openalex.org/W2963626105', 'https://openalex.org/W2963684180', 'https://openalex.org/W2963720850', 'https://openalex.org/W2963767194', 'https://openalex.org/W2963791174', 'https://openalex.org/W2963800363', 'https://openalex.org/W2966880194', 'https://openalex.org/W2989861661', 'https://openalex.org/W2990375436', 'https://openalex.org/W2997517962', 'https://openalex.org/W2997532515', 'https://openalex.org/W2998605827', 'https://openalex.org/W3007419529', 'https://openalex.org/W3017439646', 'https://openalex.org/W3019200173', 'https://openalex.org/W3034196597', 'https://openalex.org/W3034214108', 'https://openalex.org/W3034530968', 'https://openalex.org/W3034713808', 'https://openalex.org/W3034900344', 'https://openalex.org/W3035063907', 'https://openalex.org/W3035574324', 'https://openalex.org/W3036198682', 'https://openalex.org/W3036426855', 'https://openalex.org/W3036644531', 'https://openalex.org/W3036806226', 'https://openalex.org/W3038930935', 'https://openalex.org/W3040168631', 'https://openalex.org/W3083246145', 'https://openalex.org/W3092879151', 'https://openalex.org/W3092997524', 'https://openalex.org/W3093010840', 'https://openalex.org/W3094728142', 'https://openalex.org/W3096661774', 'https://openalex.org/W3096831136', 'https://openalex.org/W3108854358', 'https://openalex.org/W3118479706', 'https://openalex.org/W3120504414', 'https://openalex.org/W3125803510', 'https://openalex.org/W3135485589', 'https://openalex.org/W3135809943', 'https://openalex.org/W3152384838', 'https://openalex.org/W3173850174', 'https://openalex.org/W3174508664', 'https://openalex.org/W3174572554', 'https://openalex.org/W3174656926', 'https://openalex.org/W3175342695', 'https://openalex.org/W3175779516', 'https://openalex.org/W3178572954', 'https://openalex.org/W3178708968', 'https://openalex.org/W3183392865', 'https://openalex.org/W3186090335', 'https://openalex.org/W3186436325', 'https://openalex.org/W3189021665', 'https://openalex.org/W3189760401', 'https://openalex.org/W3195059668', 'https://openalex.org/W3196204467', 'https://openalex.org/W3197783777', 'https://openalex.org/W3209972423', 'https://openalex.org/W3215142411', 'https://openalex.org/W4200174933', 'https://openalex.org/W4205695807', 'https://openalex.org/W4206363386', 'https://openalex.org/W4210623456', 'https://openalex.org/W4211008685', 'https://openalex.org/W4213449918', 'https://openalex.org/W4214876496', 'https://openalex.org/W4221045030', 'https://openalex.org/W4283164272', 'https://openalex.org/W4285240680', 'https://openalex.org/W4288102863', 'https://openalex.org/W4297632190', 'https://openalex.org/W4310183460', 'https://openalex.org/W4312914048', 'https://openalex.org/W4312933868', 'https://openalex.org/W4315865725', 'https://openalex.org/W4316924313', 'https://openalex.org/W4321381151', 'https://openalex.org/W4327810912', 'https://openalex.org/W4361003656', 'https://openalex.org/W4362574774', 'https://openalex.org/W4367353906', 'https://openalex.org/W4372260334', 'https://openalex.org/W4379391199', 'https://openalex.org/W4381612707', 'https://openalex.org/W4381619755', 'https://openalex.org/W4384202839', 'https://openalex.org/W4385071300', 'https://openalex.org/W4385483513', 'https://openalex.org/W4385576054', 'https://openalex.org/W4385656076', 'https://openalex.org/W4385807439', 'https://openalex.org/W4386211207', 'https://openalex.org/W4386889783', 'https://openalex.org/W4386998312', 'https://openalex.org/W4387140156', 'https://openalex.org/W4387639331', 'https://openalex.org/W4387874311', 'https://openalex.org/W4387976617', 'https://openalex.org/W4388230638', 'https://openalex.org/W4388820663', 'https://openalex.org/W4388851105', 'https://openalex.org/W4389481246', 'https://openalex.org/W4389742134', 'https://openalex.org/W4391404116', 'https://openalex.org/W4392774535', 'https://openalex.org/W4392943319', 'https://openalex.org/W4393166187', 'https://openalex.org/W4393406814', 'https://openalex.org/W4395010355', 'https://openalex.org/W4396542715', 'https://openalex.org/W4396869464', 'https://openalex.org/W4398769251', 'https://openalex.org/W4399138486', 'https://openalex.org/W4399427602', 'https://openalex.org/W4400226063', 'https://openalex.org/W4400678935', 'https://openalex.org/W4401932024', 'https://openalex.org/W4402774452', 'https://openalex.org/W4404195418', 'https://openalex.org/W4405272334', 'https://openalex.org/W6661117324', 'https://openalex.org/W6743446608', 'https://openalex.org/W6764542186', 'https://openalex.org/W6767264202', 'https://openalex.org/W6798035511', 'https://openalex.org/W6843263049', 'https://openalex.org/W6854731626', 'https://openalex.org/W6872194319']"
